{
  "setupForecastRunId": "setupforecastrun-1104",
  "generatedAt": "2026-06-06T19:05:00Z",
  "case": "contains_secret",
  "domainSetupId": "domainsetup-001",
  "domain": "weather-logistics",
  "sourceManifestId": null,
  "fieldMappingId": null,
  "sourceIntakeReportId": null,
  "sourceIntakeHandoffId": "sourceintakehandoff-004",
  "sourceHandoffMethodGateId": "sourcehandoffmethodgate-004",
  "setupMethodDecisionId": null,
  "setupBenchmarkGateId": null,
  "intakeStatus": null,
  "methodDecisionStatus": null,
  "selectedMethodClass": "none",
  "selectedForecastMode": "blocked",
  "runStatus": "blocked",
  "executionMode": "not_started",
  "sourceMode": "none",
  "controls": {
    "sourceIntakeValidated": false,
    "methodDecisionValidated": false,
    "networkAccess": false,
    "liveFetch": false,
    "effectfulGeneration": false,
    "localLiveDraftConsumed": false,
    "forecastArtifactsCreated": false
  },
  "recordBinding": {
    "questionId": null,
    "forecastId": null,
    "evidencePacketId": null,
    "historyId": null,
    "forecastCardId": null,
    "forecastBundleId": null
  },
  "outputs": {
    "questionPath": null,
    "featureSnapshotPath": null,
    "evidencePacketPath": null,
    "forecastArtifactPath": null,
    "forecastHistoryPath": null
  },
  "blockedReasons": [
    "builder_rejection",
    "source_contains_secrets",
    "source_intake_not_entered"
  ],
  "nextActions": [
    "Replace rejected builder inputs before source intake: source_contains_secrets."
  ],
  "warnings": [
    "Source-handoff setup forecast execution is fixture-mode only.",
    "Execution requires a prior source-intake handoff, source-handoff method gate, setup benchmark gate, and setup method decision.",
    "Blocked handoff outcomes do not bind forecast IDs or artifact paths."
  ]
}
