{
  "setupForecastRunId": "setupforecastrun-901",
  "generatedAt": "2026-06-06T18:05:00Z",
  "case": "accepted",
  "domainSetupId": "domainsetup-001",
  "domain": "weather-logistics",
  "sourceManifestId": "sourcemanifest-001",
  "fieldMappingId": "fieldmapping-001",
  "sourceIntakeReportId": "sourceintakereport-001",
  "sourceIntakeHandoffId": null,
  "sourceHandoffMethodGateId": null,
  "setupMethodDecisionId": "setupmethoddecision-001",
  "setupBenchmarkGateId": "setupbenchmarkgate-001",
  "intakeStatus": "accepted",
  "methodDecisionStatus": "method_selected",
  "selectedMethodClass": "deterministic_statistical",
  "selectedForecastMode": "deterministic_statistical",
  "runStatus": "generated",
  "executionMode": "fixture_dry_run",
  "sourceMode": "source_intake_fixture",
  "controls": {
    "sourceIntakeValidated": true,
    "methodDecisionValidated": true,
    "networkAccess": false,
    "liveFetch": false,
    "effectfulGeneration": false,
    "localLiveDraftConsumed": false,
    "forecastArtifactsCreated": true
  },
  "recordBinding": {
    "questionId": "question-901",
    "forecastId": "forecast-901",
    "evidencePacketId": "evidence-901",
    "historyId": "history-901",
    "forecastCardId": "forecastcard-forecast-901",
    "forecastBundleId": "forecastbundle-forecast-901"
  },
  "outputs": {
    "questionPath": "spec/fixtures/generated/setup-forecast/weather-logistics-accepted-setup-question.generated.json",
    "featureSnapshotPath": "spec/fixtures/generated/setup-forecast/weather-logistics-accepted-setup-feature-snapshot.generated.json",
    "evidencePacketPath": "spec/fixtures/generated/setup-forecast/weather-logistics-accepted-setup-evidence.generated.json",
    "forecastArtifactPath": "spec/fixtures/generated/setup-forecast/weather-logistics-accepted-setup-artifact.generated.json",
    "forecastHistoryPath": "spec/fixtures/generated/setup-forecast/weather-logistics-accepted-setup-history.generated.json"
  },
  "blockedReasons": [],
  "nextActions": [],
  "warnings": [
    "Setup-aware execution is fixture-mode only.",
    "Generated forecast uses a setup-benchmark-approved deterministic method; quality claims remain blocked.",
    "Ignored local live drafts are not consumed by this milestone."
  ]
}
