{
  "setupForecastRunId": "setupforecastrun-1101",
  "generatedAt": "2026-06-06T19:05:00Z",
  "case": "unconfirmed_builder_draft",
  "domainSetupId": "domainsetup-001",
  "domain": "weather-logistics",
  "sourceManifestId": "sourcemanifestdraft-001",
  "fieldMappingId": "fieldmappingdraft-001",
  "sourceIntakeReportId": "sourceintakereport-101",
  "sourceIntakeHandoffId": "sourceintakehandoff-001",
  "sourceHandoffMethodGateId": "sourcehandoffmethodgate-001",
  "setupMethodDecisionId": "setupmethoddecision-101",
  "setupBenchmarkGateId": null,
  "intakeStatus": "needs_confirmation",
  "methodDecisionStatus": "needs_confirmation",
  "selectedMethodClass": "none",
  "selectedForecastMode": "blocked",
  "runStatus": "blocked",
  "executionMode": "not_started",
  "sourceMode": "none",
  "controls": {
    "sourceIntakeValidated": true,
    "methodDecisionValidated": true,
    "networkAccess": false,
    "liveFetch": false,
    "effectfulGeneration": false,
    "localLiveDraftConsumed": false,
    "forecastArtifactsCreated": false
  },
  "recordBinding": {
    "questionId": null,
    "forecastId": null,
    "evidencePacketId": null,
    "historyId": null,
    "forecastCardId": null,
    "forecastBundleId": null
  },
  "outputs": {
    "questionPath": null,
    "featureSnapshotPath": null,
    "evidencePacketPath": null,
    "forecastArtifactPath": null,
    "forecastHistoryPath": null
  },
  "blockedReasons": [
    "baseline_lift_positive",
    "execution_sample_threshold_met",
    "forecast_generation_not_allowed",
    "mapping_confirmation_required",
    "method_decision_needs_confirmation",
    "missing_historical_baseline",
    "missing_weather_forecast",
    "quality_sample_threshold_not_met",
    "source_intake_needs_confirmation"
  ],
  "nextActions": [
    "Confirm proposed field and alias mappings before forecast execution.",
    "Confirm proposed mappings before selecting any forecast method."
  ],
  "warnings": [
    "Source-handoff setup forecast execution is fixture-mode only.",
    "Execution requires a prior source-intake handoff, source-handoff method gate, setup benchmark gate, and setup method decision.",
    "Blocked handoff outcomes do not bind forecast IDs or artifact paths."
  ]
}
